Trial 98 finished with value: 0.9610580801963806 and parameters: {'batch_size': 128, 'filters': 11, 'kernel_size': 3, 'kernel_regularizer': 'l1', 'bias_regularizer': None, 'activation': 'swish', 'activation_dense': 'swish', 'kernel_regularizer_dense1': 'l1', 'bias_regularizer_dense1': 'l1', 'kernel_regularizer_dense2': None, 'bias_regularizer_dense2': 'l1_l2', 'optimizer': 'nadam'}. Best is trial 96 with value: 0.9929462671279907.
Trial 99 finished with value: 0.9899438321590424 and parameters: {'batch_size': 256, 'filters': 12, 'kernel_size': 3, 'kernel_regularizer': None, 'bias_regularizer': 'l1', 'activation': 'swish', 'activation_dense': 'sigmoid', 'kernel_regularizer_dense1': None, 'bias_regularizer_dense1': 'l1_l2', 'kernel_regularizer_dense2': 'l1', 'bias_regularizer_dense2': 'l1_l2', 'optimizer': 'nadam'}. Best is trial 96 with value: 0.9929462671279907.
Trial 100 finished with value: 0.9869610369205475 and parameters: {'batch_size': 128, 'filters': 14, 'kernel_size': 3, 'kernel_regularizer': None, 'bias_regularizer': 'l1_l2', 'activation': 'sigmoid', 'activation_dense': 'swish', 'kernel_regularizer_dense1': None, 'bias_regularizer_dense1': 'l1', 'kernel_regularizer_dense2': 'l1_l2', 'bias_regularizer_dense2': 'l1_l2', 'optimizer': 'adam'}. Best is trial 96 with value: 0.9929462671279907.
Trial 101 finished with value: 0.990435779094696 and parameters: {'batch_size': 128, 'filters': 15, 'kernel_size': 3, 'kernel_regularizer': None, 'bias_regularizer': 'l1', 'activation': 'swish', 'activation_dense': 'swish', 'kernel_regularizer_dense1': None, 'bias_regularizer_dense1': 'l1', 'kernel_regularizer_dense2': None, 'bias_regularizer_dense2': 'l1_l2', 'optimizer': 'nadam'}. Best is trial 96 with value: 0.9929462671279907.
Trial 102 finished with value: 0.9896685481071472 and parameters: {'batch_size': 128, 'filters': 14, 'kernel_size': 3, 'kernel_regularizer': None, 'bias_regularizer': None, 'activation': 'swish', 'activation_dense': 'swish', 'kernel_regularizer_dense1': None, 'bias_regularizer_dense1': 'l1', 'kernel_regularizer_dense2': 'l1_l2', 'bias_regularizer_dense2': 'l1_l2', 'optimizer': 'nadam'}. Best is trial 96 with value: 0.9929462671279907.
Trial 103 finished with value: 0.9835567474365234 and parameters: {'batch_size': 128, 'filters': 12, 'kernel_size': 3, 'kernel_regularizer': None, 'bias_regularizer': None, 'activation': 'relu', 'activation_dense': 'swish', 'kernel_regularizer_dense1': None, 'bias_regularizer_dense1': 'l1', 'kernel_regularizer_dense2': None, 'bias_regularizer_dense2': 'l1_l2', 'optimizer': 'nadam'}. Best is trial 96 with value: 0.9929462671279907.
Trial 104 finished with value: 0.979731559753418 and parameters: {'batch_size': 256, 'filters': 12, 'kernel_size': 3, 'kernel_regularizer': None, 'bias_regularizer': 'l1_l2', 'activation': 'swish', 'activation_dense': 'swish', 'kernel_regularizer_dense1': None, 'bias_regularizer_dense1': 'l1', 'kernel_regularizer_dense2': None, 'bias_regularizer_dense2': 'l1_l2', 'optimizer': 'nadam'}. Best is trial 96 with value: 0.9929462671279907.
Trial 105 finished with value: 0.9796617329120636 and parameters: {'batch_size': 128, 'filters': 13, 'kernel_size': 3, 'kernel_regularizer': None, 'bias_regularizer': 'l1', 'activation': 'swish', 'activation_dense': 'swish', 'kernel_regularizer_dense1': None, 'bias_regularizer_dense1': 'l1', 'kernel_regularizer_dense2': 'l1', 'bias_regularizer_dense2': 'l1_l2', 'optimizer': 'adam'}. Best is trial 96 with value: 0.9929462671279907.
Trial 106 finished with value: 0.9902256429195404 and parameters: {'batch_size': 128, 'filters': 11, 'kernel_size': 3, 'kernel_regularizer': None, 'bias_regularizer': 'l1_l2', 'activation': 'relu', 'activation_dense': 'swish', 'kernel_regularizer_dense1': None, 'bias_regularizer_dense1': 'l1', 'kernel_regularizer_dense2': None, 'bias_regularizer_dense2': 'l1', 'optimizer': 'adam'}. Best is trial 96 with value: 0.9929462671279907.
Trial 107 finished with value: 0.9831649661064148 and parameters: {'batch_size': 128, 'filters': 12, 'kernel_size': 3, 'kernel_regularizer': None, 'bias_regularizer': None, 'activation': 'swish', 'activation_dense': 'relu', 'kernel_regularizer_dense1': None, 'bias_regularizer_dense1': 'l1', 'kernel_regularizer_dense2': None, 'bias_regularizer_dense2': 'l1_l2', 'optimizer': 'nadam'}. Best is trial 96 with value: 0.9929462671279907.
Trial 108 finished with value: 0.979083240032196 and parameters: {'batch_size': 256, 'filters': 15, 'kernel_size': 3, 'kernel_regularizer': None, 'bias_regularizer': 'l1_l2', 'activation': 'relu', 'activation_dense': 'swish', 'kernel_regularizer_dense1': 'l1', 'bias_regularizer_dense1': 'l1_l2', 'kernel_regularizer_dense2': 'l1', 'bias_regularizer_dense2': 'l1_l2', 'optimizer': 'nadam'}. Best is trial 96 with value: 0.9929462671279907.
Trial 109 finished with value: 0.9901969730854034 and parameters: {'batch_size': 128, 'filters': 12, 'kernel_size': 5, 'kernel_regularizer': None, 'bias_regularizer': 'l1', 'activation': 'relu', 'activation_dense': 'swish', 'kernel_regularizer_dense1': 'l1_l2', 'bias_regularizer_dense1': 'l1', 'kernel_regularizer_dense2': None, 'bias_regularizer_dense2': 'l1_l2', 'optimizer': 'nadam'}. Best is trial 96 with value: 0.9929462671279907.
Trial 110 finished with value: 0.9916025400161743 and parameters: {'batch_size': 128, 'filters': 15, 'kernel_size': 4, 'kernel_regularizer': None, 'bias_regularizer': None, 'activation': 'relu', 'activation_dense': 'swish', 'kernel_regularizer_dense1': None, 'bias_regularizer_dense1': 'l1_l2', 'kernel_regularizer_dense2': 'l1', 'bias_regularizer_dense2': 'l1_l2', 'optimizer': 'nadam'}. Best is trial 96 with value: 0.9929462671279907.
Trial 111 finished with value: 0.9904981553554535 and parameters: {'batch_size': 128, 'filters': 10, 'kernel_size': 4, 'kernel_regularizer': None, 'bias_regularizer': None, 'activation': 'relu', 'activation_dense': 'relu', 'kernel_regularizer_dense1': None, 'bias_regularizer_dense1': 'l1_l2', 'kernel_regularizer_dense2': 'l1', 'bias_regularizer_dense2': 'l1_l2', 'optimizer': 'adam'}. Best is trial 96 with value: 0.9929462671279907.
Trial 112 finished with value: 0.9813075959682465 and parameters: {'batch_size': 128, 'filters': 14, 'kernel_size': 4, 'kernel_regularizer': None, 'bias_regularizer': None, 'activation': 'relu', 'activation_dense': 'swish', 'kernel_regularizer_dense1': 'l1_l2', 'bias_regularizer_dense1': 'l1_l2', 'kernel_regularizer_dense2': 'l1', 'bias_regularizer_dense2': 'l1_l2', 'optimizer': 'nadam'}. Best is trial 96 with value: 0.9929462671279907.
Trial 113 finished with value: 0.9915943741798401 and parameters: {'batch_size': 128, 'filters': 15, 'kernel_size': 4, 'kernel_regularizer': None, 'bias_regularizer': 'l1_l2', 'activation': 'relu', 'activation_dense': 'swish', 'kernel_regularizer_dense1': None, 'bias_regularizer_dense1': 'l1_l2', 'kernel_regularizer_dense2': 'l1', 'bias_regularizer_dense2': 'l1_l2', 'optimizer': 'nadam'}. Best is trial 96 with value: 0.9929462671279907.
Trial 114 finished with value: 0.9788797199726105 and parameters: {'batch_size': 128, 'filters': 12, 'kernel_size': 4, 'kernel_regularizer': None, 'bias_regularizer': 'l1_l2', 'activation': 'relu', 'activation_dense': 'swish', 'kernel_regularizer_dense1': None, 'bias_regularizer_dense1': 'l1_l2', 'kernel_regularizer_dense2': 'l1', 'bias_regularizer_dense2': None, 'optimizer': 'nadam'}. Best is trial 96 with value: 0.9929462671279907.
Trial 115 finished with value: 0.36005623638629913 and parameters: {'batch_size': 128, 'filters': 14, 'kernel_size': 3, 'kernel_regularizer': 'l1_l2', 'bias_regularizer': None, 'activation': 'swish', 'activation_dense': 'sigmoid', 'kernel_regularizer_dense1': 'l1_l2', 'bias_regularizer_dense1': 'l1', 'kernel_regularizer_dense2': None, 'bias_regularizer_dense2': 'l1_l2', 'optimizer': 'nadam'}. Best is trial 96 with value: 0.9929462671279907.
Trial 116 finished with value: 0.982598751783371 and parameters: {'batch_size': 128, 'filters': 13, 'kernel_size': 3, 'kernel_regularizer': None, 'bias_regularizer': None, 'activation': 'swish', 'activation_dense': 'swish', 'kernel_regularizer_dense1': None, 'bias_regularizer_dense1': 'l1', 'kernel_regularizer_dense2': None, 'bias_regularizer_dense2': 'l1_l2', 'optimizer': 'adam'}. Best is trial 96 with value: 0.9929462671279907.
Trial 117 finished with value: 0.9806214869022369 and parameters: {'batch_size': 128, 'filters': 15, 'kernel_size': 3, 'kernel_regularizer': None, 'bias_regularizer': 'l1', 'activation': 'swish', 'activation_dense': 'swish', 'kernel_regularizer_dense1': None, 'bias_regularizer_dense1': 'l1', 'kernel_regularizer_dense2': None, 'bias_regularizer_dense2': 'l1', 'optimizer': 'adam'}. Best is trial 96 with value: 0.9929462671279907.
Trial 118 finished with value: 0.9573375284671783 and parameters: {'batch_size': 128, 'filters': 13, 'kernel_size': 4, 'kernel_regularizer': 'l1_l2', 'bias_regularizer': 'l1_l2', 'activation': 'relu', 'activation_dense': 'swish', 'kernel_regularizer_dense1': None, 'bias_regularizer_dense1': 'l1_l2', 'kernel_regularizer_dense2': 'l1', 'bias_regularizer_dense2': 'l1_l2', 'optimizer': 'nadam'}. Best is trial 96 with value: 0.9929462671279907.
Trial 119 finished with value: 0.9788304269313812 and parameters: {'batch_size': 128, 'filters': 9, 'kernel_size': 4, 'kernel_regularizer': None, 'bias_regularizer': None, 'activation': 'sigmoid', 'activation_dense': 'swish', 'kernel_regularizer_dense1': None, 'bias_regularizer_dense1': 'l1_l2', 'kernel_regularizer_dense2': 'l1', 'bias_regularizer_dense2': 'l1_l2', 'optimizer': 'nadam'}. Best is trial 96 with value: 0.9929462671279907.
