Trial 80 finished with value: 0.9557859301567078 and parameters: {'batch_size': 256, 'filters': 14, 'kernel_size': 3, 'kernel_regularizer': 'l1_l2', 'bias_regularizer': 'l1_l2', 'activation': 'swish', 'activation_dense': 'swish', 'kernel_regularizer_dense1': None, 'bias_regularizer_dense1': 'l1_l2', 'kernel_regularizer_dense2': 'l1', 'bias_regularizer_dense2': 'l1_l2', 'optimizer': 'nadam'}. Best is trial 67 with value: 0.9927699267864227.
Trial 81 finished with value: 0.9768469631671906 and parameters: {'batch_size': 256, 'filters': 13, 'kernel_size': 3, 'kernel_regularizer': None, 'bias_regularizer': 'l1_l2', 'activation': 'swish', 'activation_dense': 'swish', 'kernel_regularizer_dense1': 'l1', 'bias_regularizer_dense1': None, 'kernel_regularizer_dense2': 'l1', 'bias_regularizer_dense2': 'l1_l2', 'optimizer': 'nadam'}. Best is trial 67 with value: 0.9927699267864227.
Trial 82 finished with value: 0.978277713060379 and parameters: {'batch_size': 128, 'filters': 9, 'kernel_size': 3, 'kernel_regularizer': None, 'bias_regularizer': 'l1_l2', 'activation': 'relu', 'activation_dense': 'swish', 'kernel_regularizer_dense1': 'l1', 'bias_regularizer_dense1': 'l1', 'kernel_regularizer_dense2': None, 'bias_regularizer_dense2': 'l1_l2', 'optimizer': 'nadam'}. Best is trial 67 with value: 0.9927699267864227.
Trial 83 finished with value: 0.9756296873092651 and parameters: {'batch_size': 256, 'filters': 13, 'kernel_size': 3, 'kernel_regularizer': None, 'bias_regularizer': 'l1', 'activation': 'swish', 'activation_dense': 'swish', 'kernel_regularizer_dense1': None, 'bias_regularizer_dense1': 'l1', 'kernel_regularizer_dense2': 'l1_l2', 'bias_regularizer_dense2': 'l1_l2', 'optimizer': 'adam'}. Best is trial 67 with value: 0.9927699267864227.
Trial 84 finished with value: 0.9880714118480682 and parameters: {'batch_size': 256, 'filters': 15, 'kernel_size': 5, 'kernel_regularizer': None, 'bias_regularizer': None, 'activation': 'sigmoid', 'activation_dense': 'swish', 'kernel_regularizer_dense1': None, 'bias_regularizer_dense1': 'l1_l2', 'kernel_regularizer_dense2': 'l1_l2', 'bias_regularizer_dense2': 'l1_l2', 'optimizer': 'nadam'}. Best is trial 67 with value: 0.9927699267864227.
Trial 85 finished with value: 0.9777144193649292 and parameters: {'batch_size': 128, 'filters': 15, 'kernel_size': 4, 'kernel_regularizer': None, 'bias_regularizer': 'l1', 'activation': 'swish', 'activation_dense': 'swish', 'kernel_regularizer_dense1': None, 'bias_regularizer_dense1': 'l1', 'kernel_regularizer_dense2': 'l1_l2', 'bias_regularizer_dense2': None, 'optimizer': 'adam'}. Best is trial 67 with value: 0.9927699267864227.
Trial 86 finished with value: 0.9904680550098419 and parameters: {'batch_size': 128, 'filters': 11, 'kernel_size': 3, 'kernel_regularizer': None, 'bias_regularizer': 'l1', 'activation': 'sigmoid', 'activation_dense': 'swish', 'kernel_regularizer_dense1': None, 'bias_regularizer_dense1': None, 'kernel_regularizer_dense2': None, 'bias_regularizer_dense2': 'l1_l2', 'optimizer': 'nadam'}. Best is trial 67 with value: 0.9927699267864227.
Trial 87 finished with value: 0.9052160680294037 and parameters: {'batch_size': 256, 'filters': 11, 'kernel_size': 3, 'kernel_regularizer': None, 'bias_regularizer': None, 'activation': 'sigmoid', 'activation_dense': 'sigmoid', 'kernel_regularizer_dense1': None, 'bias_regularizer_dense1': 'l1', 'kernel_regularizer_dense2': 'l1_l2', 'bias_regularizer_dense2': 'l1', 'optimizer': 'nadam'}. Best is trial 67 with value: 0.9927699267864227.
Trial 88 finished with value: 0.9756039083003998 and parameters: {'batch_size': 256, 'filters': 12, 'kernel_size': 5, 'kernel_regularizer': None, 'bias_regularizer': 'l1_l2', 'activation': 'relu', 'activation_dense': 'swish', 'kernel_regularizer_dense1': None, 'bias_regularizer_dense1': 'l1_l2', 'kernel_regularizer_dense2': 'l1', 'bias_regularizer_dense2': 'l1_l2', 'optimizer': 'nadam'}. Best is trial 67 with value: 0.9927699267864227.
Trial 89 finished with value: 0.9904241561889648 and parameters: {'batch_size': 256, 'filters': 13, 'kernel_size': 4, 'kernel_regularizer': None, 'bias_regularizer': 'l1_l2', 'activation': 'relu', 'activation_dense': 'swish', 'kernel_regularizer_dense1': None, 'bias_regularizer_dense1': 'l1', 'kernel_regularizer_dense2': None, 'bias_regularizer_dense2': 'l1_l2', 'optimizer': 'nadam'}. Best is trial 67 with value: 0.9927699267864227.
Trial 90 finished with value: 0.991880863904953 and parameters: {'batch_size': 128, 'filters': 15, 'kernel_size': 3, 'kernel_regularizer': None, 'bias_regularizer': 'l1_l2', 'activation': 'relu', 'activation_dense': 'sigmoid', 'kernel_regularizer_dense1': None, 'bias_regularizer_dense1': 'l1_l2', 'kernel_regularizer_dense2': 'l1', 'bias_regularizer_dense2': 'l1_l2', 'optimizer': 'nadam'}. Best is trial 67 with value: 0.9927699267864227.
Trial 91 finished with value: 0.9601867198944092 and parameters: {'batch_size': 128, 'filters': 12, 'kernel_size': 3, 'kernel_regularizer': None, 'bias_regularizer': 'l1_l2', 'activation': 'relu', 'activation_dense': 'sigmoid', 'kernel_regularizer_dense1': 'l1_l2', 'bias_regularizer_dense1': 'l1_l2', 'kernel_regularizer_dense2': 'l1', 'bias_regularizer_dense2': 'l1_l2', 'optimizer': 'nadam'}. Best is trial 67 with value: 0.9927699267864227.
Trial 92 finished with value: 0.9691482782363892 and parameters: {'batch_size': 256, 'filters': 13, 'kernel_size': 3, 'kernel_regularizer': 'l1_l2', 'bias_regularizer': 'l1_l2', 'activation': 'relu', 'activation_dense': 'swish', 'kernel_regularizer_dense1': None, 'bias_regularizer_dense1': 'l1', 'kernel_regularizer_dense2': None, 'bias_regularizer_dense2': 'l1_l2', 'optimizer': 'nadam'}. Best is trial 67 with value: 0.9927699267864227.
Trial 93 finished with value: 0.9709701240062714 and parameters: {'batch_size': 128, 'filters': 8, 'kernel_size': 3, 'kernel_regularizer': 'l1_l2', 'bias_regularizer': 'l1', 'activation': 'relu', 'activation_dense': 'swish', 'kernel_regularizer_dense1': None, 'bias_regularizer_dense1': 'l1', 'kernel_regularizer_dense2': None, 'bias_regularizer_dense2': 'l1_l2', 'optimizer': 'nadam'}. Best is trial 67 with value: 0.9927699267864227.
Trial 94 finished with value: 0.9750015735626221 and parameters: {'batch_size': 128, 'filters': 14, 'kernel_size': 3, 'kernel_regularizer': None, 'bias_regularizer': 'l1_l2', 'activation': 'relu', 'activation_dense': 'relu', 'kernel_regularizer_dense1': None, 'bias_regularizer_dense1': 'l1_l2', 'kernel_regularizer_dense2': 'l1_l2', 'bias_regularizer_dense2': 'l1_l2', 'optimizer': 'nadam'}. Best is trial 67 with value: 0.9927699267864227.
Trial 95 finished with value: 0.9910523295402527 and parameters: {'batch_size': 128, 'filters': 15, 'kernel_size': 3, 'kernel_regularizer': None, 'bias_regularizer': 'l1_l2', 'activation': 'relu', 'activation_dense': 'sigmoid', 'kernel_regularizer_dense1': None, 'bias_regularizer_dense1': 'l1_l2', 'kernel_regularizer_dense2': 'l1', 'bias_regularizer_dense2': 'l1_l2', 'optimizer': 'nadam'}. Best is trial 67 with value: 0.9927699267864227.
Trial 96 finished with value: 0.9929462671279907 and parameters: {'batch_size': 128, 'filters': 14, 'kernel_size': 3, 'kernel_regularizer': None, 'bias_regularizer': None, 'activation': 'swish', 'activation_dense': 'swish', 'kernel_regularizer_dense1': None, 'bias_regularizer_dense1': 'l1', 'kernel_regularizer_dense2': None, 'bias_regularizer_dense2': 'l1_l2', 'optimizer': 'nadam'}. Best is trial 96 with value: 0.9929462671279907.
Trial 97 finished with value: 0.9816552996635437 and parameters: {'batch_size': 128, 'filters': 12, 'kernel_size': 4, 'kernel_regularizer': None, 'bias_regularizer': None, 'activation': 'swish', 'activation_dense': 'swish', 'kernel_regularizer_dense1': None, 'bias_regularizer_dense1': 'l1', 'kernel_regularizer_dense2': None, 'bias_regularizer_dense2': 'l1_l2', 'optimizer': 'nadam'}. Best is trial 96 with value: 0.9929462671279907.
Trial 98 finished with value: 0.9610580801963806 and parameters: {'batch_size': 128, 'filters': 11, 'kernel_size': 3, 'kernel_regularizer': 'l1', 'bias_regularizer': None, 'activation': 'swish', 'activation_dense': 'swish', 'kernel_regularizer_dense1': 'l1', 'bias_regularizer_dense1': 'l1', 'kernel_regularizer_dense2': None, 'bias_regularizer_dense2': 'l1_l2', 'optimizer': 'nadam'}. Best is trial 96 with value: 0.9929462671279907.
Trial 99 finished with value: 0.9899438321590424 and parameters: {'batch_size': 256, 'filters': 12, 'kernel_size': 3, 'kernel_regularizer': None, 'bias_regularizer': 'l1', 'activation': 'swish', 'activation_dense': 'sigmoid', 'kernel_regularizer_dense1': None, 'bias_regularizer_dense1': 'l1_l2', 'kernel_regularizer_dense2': 'l1', 'bias_regularizer_dense2': 'l1_l2', 'optimizer': 'nadam'}. Best is trial 96 with value: 0.9929462671279907.
Trial 100 finished with value: 0.9869610369205475 and parameters: {'batch_size': 128, 'filters': 14, 'kernel_size': 3, 'kernel_regularizer': None, 'bias_regularizer': 'l1_l2', 'activation': 'sigmoid', 'activation_dense': 'swish', 'kernel_regularizer_dense1': None, 'bias_regularizer_dense1': 'l1', 'kernel_regularizer_dense2': 'l1_l2', 'bias_regularizer_dense2': 'l1_l2', 'optimizer': 'adam'}. Best is trial 96 with value: 0.9929462671279907.
Trial 101 finished with value: 0.990435779094696 and parameters: {'batch_size': 128, 'filters': 15, 'kernel_size': 3, 'kernel_regularizer': None, 'bias_regularizer': 'l1', 'activation': 'swish', 'activation_dense': 'swish', 'kernel_regularizer_dense1': None, 'bias_regularizer_dense1': 'l1', 'kernel_regularizer_dense2': None, 'bias_regularizer_dense2': 'l1_l2', 'optimizer': 'nadam'}. Best is trial 96 with value: 0.9929462671279907.
Trial 102 finished with value: 0.9896685481071472 and parameters: {'batch_size': 128, 'filters': 14, 'kernel_size': 3, 'kernel_regularizer': None, 'bias_regularizer': None, 'activation': 'swish', 'activation_dense': 'swish', 'kernel_regularizer_dense1': None, 'bias_regularizer_dense1': 'l1', 'kernel_regularizer_dense2': 'l1_l2', 'bias_regularizer_dense2': 'l1_l2', 'optimizer': 'nadam'}. Best is trial 96 with value: 0.9929462671279907.
Trial 103 finished with value: 0.9835567474365234 and parameters: {'batch_size': 128, 'filters': 12, 'kernel_size': 3, 'kernel_regularizer': None, 'bias_regularizer': None, 'activation': 'relu', 'activation_dense': 'swish', 'kernel_regularizer_dense1': None, 'bias_regularizer_dense1': 'l1', 'kernel_regularizer_dense2': None, 'bias_regularizer_dense2': 'l1_l2', 'optimizer': 'nadam'}. Best is trial 96 with value: 0.9929462671279907.
Trial 104 finished with value: 0.979731559753418 and parameters: {'batch_size': 256, 'filters': 12, 'kernel_size': 3, 'kernel_regularizer': None, 'bias_regularizer': 'l1_l2', 'activation': 'swish', 'activation_dense': 'swish', 'kernel_regularizer_dense1': None, 'bias_regularizer_dense1': 'l1', 'kernel_regularizer_dense2': None, 'bias_regularizer_dense2': 'l1_l2', 'optimizer': 'nadam'}. Best is trial 96 with value: 0.9929462671279907.
Trial 105 finished with value: 0.9796617329120636 and parameters: {'batch_size': 128, 'filters': 13, 'kernel_size': 3, 'kernel_regularizer': None, 'bias_regularizer': 'l1', 'activation': 'swish', 'activation_dense': 'swish', 'kernel_regularizer_dense1': None, 'bias_regularizer_dense1': 'l1', 'kernel_regularizer_dense2': 'l1', 'bias_regularizer_dense2': 'l1_l2', 'optimizer': 'adam'}. Best is trial 96 with value: 0.9929462671279907.
Trial 106 finished with value: 0.9902256429195404 and parameters: {'batch_size': 128, 'filters': 11, 'kernel_size': 3, 'kernel_regularizer': None, 'bias_regularizer': 'l1_l2', 'activation': 'relu', 'activation_dense': 'swish', 'kernel_regularizer_dense1': None, 'bias_regularizer_dense1': 'l1', 'kernel_regularizer_dense2': None, 'bias_regularizer_dense2': 'l1', 'optimizer': 'adam'}. Best is trial 96 with value: 0.9929462671279907.
Trial 107 finished with value: 0.9831649661064148 and parameters: {'batch_size': 128, 'filters': 12, 'kernel_size': 3, 'kernel_regularizer': None, 'bias_regularizer': None, 'activation': 'swish', 'activation_dense': 'relu', 'kernel_regularizer_dense1': None, 'bias_regularizer_dense1': 'l1', 'kernel_regularizer_dense2': None, 'bias_regularizer_dense2': 'l1_l2', 'optimizer': 'nadam'}. Best is trial 96 with value: 0.9929462671279907.
Trial 108 finished with value: 0.979083240032196 and parameters: {'batch_size': 256, 'filters': 15, 'kernel_size': 3, 'kernel_regularizer': None, 'bias_regularizer': 'l1_l2', 'activation': 'relu', 'activation_dense': 'swish', 'kernel_regularizer_dense1': 'l1', 'bias_regularizer_dense1': 'l1_l2', 'kernel_regularizer_dense2': 'l1', 'bias_regularizer_dense2': 'l1_l2', 'optimizer': 'nadam'}. Best is trial 96 with value: 0.9929462671279907.
Trial 109 finished with value: 0.9901969730854034 and parameters: {'batch_size': 128, 'filters': 12, 'kernel_size': 5, 'kernel_regularizer': None, 'bias_regularizer': 'l1', 'activation': 'relu', 'activation_dense': 'swish', 'kernel_regularizer_dense1': 'l1_l2', 'bias_regularizer_dense1': 'l1', 'kernel_regularizer_dense2': None, 'bias_regularizer_dense2': 'l1_l2', 'optimizer': 'nadam'}. Best is trial 96 with value: 0.9929462671279907.
Trial 110 finished with value: 0.9916025400161743 and parameters: {'batch_size': 128, 'filters': 15, 'kernel_size': 4, 'kernel_regularizer': None, 'bias_regularizer': None, 'activation': 'relu', 'activation_dense': 'swish', 'kernel_regularizer_dense1': None, 'bias_regularizer_dense1': 'l1_l2', 'kernel_regularizer_dense2': 'l1', 'bias_regularizer_dense2': 'l1_l2', 'optimizer': 'nadam'}. Best is trial 96 with value: 0.9929462671279907.
Trial 111 finished with value: 0.9904981553554535 and parameters: {'batch_size': 128, 'filters': 10, 'kernel_size': 4, 'kernel_regularizer': None, 'bias_regularizer': None, 'activation': 'relu', 'activation_dense': 'relu', 'kernel_regularizer_dense1': None, 'bias_regularizer_dense1': 'l1_l2', 'kernel_regularizer_dense2': 'l1', 'bias_regularizer_dense2': 'l1_l2', 'optimizer': 'adam'}. Best is trial 96 with value: 0.9929462671279907.
Trial 112 finished with value: 0.9813075959682465 and parameters: {'batch_size': 128, 'filters': 14, 'kernel_size': 4, 'kernel_regularizer': None, 'bias_regularizer': None, 'activation': 'relu', 'activation_dense': 'swish', 'kernel_regularizer_dense1': 'l1_l2', 'bias_regularizer_dense1': 'l1_l2', 'kernel_regularizer_dense2': 'l1', 'bias_regularizer_dense2': 'l1_l2', 'optimizer': 'nadam'}. Best is trial 96 with value: 0.9929462671279907.
Trial 113 finished with value: 0.9915943741798401 and parameters: {'batch_size': 128, 'filters': 15, 'kernel_size': 4, 'kernel_regularizer': None, 'bias_regularizer': 'l1_l2', 'activation': 'relu', 'activation_dense': 'swish', 'kernel_regularizer_dense1': None, 'bias_regularizer_dense1': 'l1_l2', 'kernel_regularizer_dense2': 'l1', 'bias_regularizer_dense2': 'l1_l2', 'optimizer': 'nadam'}. Best is trial 96 with value: 0.9929462671279907.
Trial 114 finished with value: 0.9788797199726105 and parameters: {'batch_size': 128, 'filters': 12, 'kernel_size': 4, 'kernel_regularizer': None, 'bias_regularizer': 'l1_l2', 'activation': 'relu', 'activation_dense': 'swish', 'kernel_regularizer_dense1': None, 'bias_regularizer_dense1': 'l1_l2', 'kernel_regularizer_dense2': 'l1', 'bias_regularizer_dense2': None, 'optimizer': 'nadam'}. Best is trial 96 with value: 0.9929462671279907.
Trial 115 finished with value: 0.36005623638629913 and parameters: {'batch_size': 128, 'filters': 14, 'kernel_size': 3, 'kernel_regularizer': 'l1_l2', 'bias_regularizer': None, 'activation': 'swish', 'activation_dense': 'sigmoid', 'kernel_regularizer_dense1': 'l1_l2', 'bias_regularizer_dense1': 'l1', 'kernel_regularizer_dense2': None, 'bias_regularizer_dense2': 'l1_l2', 'optimizer': 'nadam'}. Best is trial 96 with value: 0.9929462671279907.
Trial 116 finished with value: 0.982598751783371 and parameters: {'batch_size': 128, 'filters': 13, 'kernel_size': 3, 'kernel_regularizer': None, 'bias_regularizer': None, 'activation': 'swish', 'activation_dense': 'swish', 'kernel_regularizer_dense1': None, 'bias_regularizer_dense1': 'l1', 'kernel_regularizer_dense2': None, 'bias_regularizer_dense2': 'l1_l2', 'optimizer': 'adam'}. Best is trial 96 with value: 0.9929462671279907.
Trial 117 finished with value: 0.9806214869022369 and parameters: {'batch_size': 128, 'filters': 15, 'kernel_size': 3, 'kernel_regularizer': None, 'bias_regularizer': 'l1', 'activation': 'swish', 'activation_dense': 'swish', 'kernel_regularizer_dense1': None, 'bias_regularizer_dense1': 'l1', 'kernel_regularizer_dense2': None, 'bias_regularizer_dense2': 'l1', 'optimizer': 'adam'}. Best is trial 96 with value: 0.9929462671279907.
Trial 118 finished with value: 0.9573375284671783 and parameters: {'batch_size': 128, 'filters': 13, 'kernel_size': 4, 'kernel_regularizer': 'l1_l2', 'bias_regularizer': 'l1_l2', 'activation': 'relu', 'activation_dense': 'swish', 'kernel_regularizer_dense1': None, 'bias_regularizer_dense1': 'l1_l2', 'kernel_regularizer_dense2': 'l1', 'bias_regularizer_dense2': 'l1_l2', 'optimizer': 'nadam'}. Best is trial 96 with value: 0.9929462671279907.
Trial 119 finished with value: 0.9788304269313812 and parameters: {'batch_size': 128, 'filters': 9, 'kernel_size': 4, 'kernel_regularizer': None, 'bias_regularizer': None, 'activation': 'sigmoid', 'activation_dense': 'swish', 'kernel_regularizer_dense1': None, 'bias_regularizer_dense1': 'l1_l2', 'kernel_regularizer_dense2': 'l1', 'bias_regularizer_dense2': 'l1_l2', 'optimizer': 'nadam'}. Best is trial 96 with value: 0.9929462671279907.
er': None, 'activation': 'sigmoid', 'activation_dense': 'sigmoid', 'kernel_regularizer_dense1': None, 'bias_regularizer_dense1': 'l1', 'kernel_regularizer_dense2': 'l1', 'bias_regularizer_dense2': 'l1_l2', 'optimizer': 'adam'}. Best is trial 0 with value: 0.3550901263952255.
Trial 1 finished with value: 0.9809463322162628 and parameters: {'batch_size': 256, 'filters': 3, 'kernel_size': 5, 'kernel_regularizer': None, 'bias_regularizer': 'l1_l2', 'activation': 'swish', 'activation_dense': 'swish', 'kernel_regularizer_dense1': None, 'bias_regularizer_dense1': 'l1_l2', 'kernel_regularizer_dense2': None, 'bias_regularizer_dense2': 'l1_l2', 'optimizer': 'adam'}. Best is trial 1 with value: 0.9809463322162628.
Trial 2 finished with value: 0.35236426442861557 and parameters: {'batch_size': 256, 'filters': 11, 'kernel_size': 3, 'kernel_regularizer': 'l1_l2', 'bias_regularizer': 'l1', 'activation': 'relu', 'activation_dense': 'sigmoid', 'kernel_regularizer_dense1': 'l1', 'bias_regularizer_dense1': 'l1', 'kernel_regularizer_dense2': 'l1', 'bias_regularizer_dense2': 'l1_l2', 'optimizer': 'nadam'}. Best is trial 1 with value: 0.9809463322162628.
Trial 3 finished with value: 0.8385486900806427 and parameters: {'batch_size': 128, 'filters': 9, 'kernel_size': 5, 'kernel_regularizer': 'l1_l2', 'bias_regularizer': 'l1', 'activation': 'swish', 'activation_dense': 'sigmoid', 'kernel_regularizer_dense1': 'l1', 'bias_regularizer_dense1': None, 'kernel_regularizer_dense2': 'l1_l2', 'bias_regularizer_dense2': 'l1', 'optimizer': 'nadam'}. Best is trial 1 with value: 0.9809463322162628.
Trial 4 finished with value: 0.989600270986557 and parameters: {'batch_size': 128, 'filters': 10, 'kernel_size': 5, 'kernel_regularizer': None, 'bias_regularizer': None, 'activation': 'relu', 'activation_dense': 'swish', 'kernel_regularizer_dense1': 'l1', 'bias_regularizer_dense1': 'l1_l2', 'kernel_regularizer_dense2': None, 'bias_regularizer_dense2': 'l1_l2', 'optimizer': 'nadam'}. Best is trial 4 with value: 0.989600270986557.
Trial 5 finished with value: 0.3603455275297165 and parameters: {'batch_size': 128, 'filters': 14, 'kernel_size': 4, 'kernel_regularizer': 'l1_l2', 'bias_regularizer': None, 'activation': 'sigmoid', 'activation_dense': 'swish', 'kernel_regularizer_dense1': 'l1_l2', 'bias_regularizer_dense1': None, 'kernel_regularizer_dense2': None, 'bias_regularizer_dense2': None, 'optimizer': 'nadam'}. Best is trial 4 with value: 0.989600270986557.
Trial 6 finished with value: 0.9722701013088226 and parameters: {'batch_size': 128, 'filters': 10, 'kernel_size': 3, 'kernel_regularizer': None, 'bias_regularizer': 'l1_l2', 'activation': 'swish', 'activation_dense': 'relu', 'kernel_regularizer_dense1': 'l1_l2', 'bias_regularizer_dense1': None, 'kernel_regularizer_dense2': 'l1', 'bias_regularizer_dense2': None, 'optimizer': 'nadam'}. Best is trial 4 with value: 0.989600270986557.
Trial 7 finished with value: 0.9689816236495972 and parameters: {'batch_size': 256, 'filters': 9, 'kernel_size': 5, 'kernel_regularizer': 'l1', 'bias_regularizer': 'l1_l2', 'activation': 'relu', 'activation_dense': 'swish', 'kernel_regularizer_dense1': None, 'bias_regularizer_dense1': None, 'kernel_regularizer_dense2': None, 'bias_regularizer_dense2': 'l1_l2', 'optimizer': 'adam'}. Best is trial 4 with value: 0.989600270986557.
Trial 8 finished with value: 0.3602011054754257 and parameters: {'batch_size': 256, 'filters': 4, 'kernel_size': 3, 'kernel_regularizer': None, 'bias_regularizer': 'l1_l2', 'activation': 'sigmoid', 'activation_dense': 'sigmoid', 'kernel_regularizer_dense1': 'l1', 'bias_regularizer_dense1': 'l1_l2', 'kernel_regularizer_dense2': 'l1', 'bias_regularizer_dense2': None, 'optimizer': 'nadam'}. Best is trial 4 with value: 0.989600270986557.
Trial 9 finished with value: 0.3487205430865288 and parameters: {'batch_size': 256, 'filters': 8, 'kernel_size': 3, 'kernel_regularizer': 'l1_l2', 'bias_regularizer': 'l1', 'activation': 'swish', 'activation_dense': 'swish', 'kernel_regularizer_dense1': 'l1_l2', 'bias_regularizer_dense1': None, 'kernel_regularizer_dense2': 'l1_l2', 'bias_regularizer_dense2': 'l1', 'optimizer': 'adam'}. Best is trial 4 with value: 0.989600270986557.
