Trial 49 finished with value: 0.5827291905879974 and parameters: {'batch_size': 128, 'filters': 14, 'kernel_size': 5, 'kernel_regularizer': None, 'bias_regularizer': 'l1', 'activation': 'relu', 'activation_dense': 'sigmoid', 'kernel_regularizer_dense1': 'l1', 'bias_regularizer_dense1': 'l1', 'kernel_regularizer_dense2': 'l1', 'bias_regularizer_dense2': None, 'optimizer': 'adam'}. Best is trial 44 with value: 0.9430480003356934.
Trial 50 finished with value: 0.43466709554195404 and parameters: {'batch_size': 256, 'filters': 12, 'kernel_size': 5, 'kernel_regularizer': None, 'bias_regularizer': 'l1', 'activation': 'swish', 'activation_dense': 'swish', 'kernel_regularizer_dense1': 'l1', 'bias_regularizer_dense1': 'l1', 'kernel_regularizer_dense2': 'l1', 'bias_regularizer_dense2': None, 'optimizer': 'nadam'}. Best is trial 44 with value: 0.9430480003356934.
Trial 51 finished with value: 0.622273325920105 and parameters: {'batch_size': 256, 'filters': 15, 'kernel_size': 5, 'kernel_regularizer': None, 'bias_regularizer': 'l1', 'activation': 'relu', 'activation_dense': 'swish', 'kernel_regularizer_dense1': None, 'bias_regularizer_dense1': 'l1', 'kernel_regularizer_dense2': 'l1', 'bias_regularizer_dense2': None, 'optimizer': 'adam'}. Best is trial 44 with value: 0.9430480003356934.
Trial 52 finished with value: 0.48310573399066925 and parameters: {'batch_size': 128, 'filters': 12, 'kernel_size': 5, 'kernel_regularizer': 'l1_l2', 'bias_regularizer': 'l1', 'activation': 'relu', 'activation_dense': 'swish', 'kernel_regularizer_dense1': 'l1', 'bias_regularizer_dense1': 'l1', 'kernel_regularizer_dense2': 'l1_l2', 'bias_regularizer_dense2': None, 'optimizer': 'nadam'}. Best is trial 44 with value: 0.9430480003356934.
Trial 53 finished with value: 0.9402931332588196 and parameters: {'batch_size': 256, 'filters': 11, 'kernel_size': 5, 'kernel_regularizer': None, 'bias_regularizer': 'l1', 'activation': 'relu', 'activation_dense': 'relu', 'kernel_regularizer_dense1': 'l1', 'bias_regularizer_dense1': 'l1', 'kernel_regularizer_dense2': None, 'bias_regularizer_dense2': None, 'optimizer': 'adam'}. Best is trial 44 with value: 0.9430480003356934.
Trial 54 finished with value: 0.5119067877531052 and parameters: {'batch_size': 256, 'filters': 7, 'kernel_size': 5, 'kernel_regularizer': None, 'bias_regularizer': 'l1', 'activation': 'relu', 'activation_dense': 'relu', 'kernel_regularizer_dense1': 'l1', 'bias_regularizer_dense1': 'l1', 'kernel_regularizer_dense2': None, 'bias_regularizer_dense2': None, 'optimizer': 'adam'}. Best is trial 44 with value: 0.9430480003356934.
Trial 55 finished with value: 0.9263892769813538 and parameters: {'batch_size': 128, 'filters': 10, 'kernel_size': 5, 'kernel_regularizer': None, 'bias_regularizer': 'l1', 'activation': 'swish', 'activation_dense': 'swish', 'kernel_regularizer_dense1': 'l1', 'bias_regularizer_dense1': 'l1_l2', 'kernel_regularizer_dense2': 'l1', 'bias_regularizer_dense2': None, 'optimizer': 'adam'}. Best is trial 44 with value: 0.9430480003356934.
Trial 56 finished with value: 0.9360641539096832 and parameters: {'batch_size': 128, 'filters': 10, 'kernel_size': 5, 'kernel_regularizer': None, 'bias_regularizer': 'l1', 'activation': 'swish', 'activation_dense': 'swish', 'kernel_regularizer_dense1': 'l1', 'bias_regularizer_dense1': 'l1_l2', 'kernel_regularizer_dense2': 'l1', 'bias_regularizer_dense2': 'l1_l2', 'optimizer': 'adam'}. Best is trial 44 with value: 0.9430480003356934.
Trial 57 finished with value: 0.382597416639328 and parameters: {'batch_size': 256, 'filters': 12, 'kernel_size': 5, 'kernel_regularizer': 'l1', 'bias_regularizer': 'l1', 'activation': 'relu', 'activation_dense': 'relu', 'kernel_regularizer_dense1': 'l1', 'bias_regularizer_dense1': 'l1', 'kernel_regularizer_dense2': None, 'bias_regularizer_dense2': 'l1_l2', 'optimizer': 'adam'}. Best is trial 44 with value: 0.9430480003356934.
Trial 58 finished with value: 0.6356061398983002 and parameters: {'batch_size': 256, 'filters': 10, 'kernel_size': 5, 'kernel_regularizer': None, 'bias_regularizer': 'l1', 'activation': 'swish', 'activation_dense': 'swish', 'kernel_regularizer_dense1': 'l1', 'bias_regularizer_dense1': 'l1_l2', 'kernel_regularizer_dense2': 'l1_l2', 'bias_regularizer_dense2': 'l1_l2', 'optimizer': 'adam'}. Best is trial 44 with value: 0.9430480003356934.
Trial 59 finished with value: 0.5185760706663132 and parameters: {'batch_size': 128, 'filters': 13, 'kernel_size': 5, 'kernel_regularizer': 'l1_l2', 'bias_regularizer': 'l1', 'activation': 'relu', 'activation_dense': 'swish', 'kernel_regularizer_dense1': 'l1', 'bias_regularizer_dense1': 'l1', 'kernel_regularizer_dense2': 'l1', 'bias_regularizer_dense2': 'l1_l2', 'optimizer': 'adam'}. Best is trial 44 with value: 0.9430480003356934.
Trial 60 finished with value: 0.6364203095436096 and parameters: {'batch_size': 128, 'filters': 15, 'kernel_size': 3, 'kernel_regularizer': None, 'bias_regularizer': 'l1', 'activation': 'relu', 'activation_dense': 'swish', 'kernel_regularizer_dense1': 'l1_l2', 'bias_regularizer_dense1': None, 'kernel_regularizer_dense2': 'l1_l2', 'bias_regularizer_dense2': 'l1_l2', 'optimizer': 'adam'}. Best is trial 44 with value: 0.9430480003356934.
Trial 61 finished with value: 0.7761759757995605 and parameters: {'batch_size': 128, 'filters': 7, 'kernel_size': 5, 'kernel_regularizer': None, 'bias_regularizer': 'l1', 'activation': 'swish', 'activation_dense': 'swish', 'kernel_regularizer_dense1': 'l1', 'bias_regularizer_dense1': 'l1_l2', 'kernel_regularizer_dense2': 'l1', 'bias_regularizer_dense2': None, 'optimizer': 'adam'}. Best is trial 44 with value: 0.9430480003356934.
Trial 62 finished with value: 0.7390756607055664 and parameters: {'batch_size': 128, 'filters': 14, 'kernel_size': 3, 'kernel_regularizer': None, 'bias_regularizer': 'l1', 'activation': 'swish', 'activation_dense': 'swish', 'kernel_regularizer_dense1': 'l1', 'bias_regularizer_dense1': 'l1_l2', 'kernel_regularizer_dense2': 'l1', 'bias_regularizer_dense2': None, 'optimizer': 'adam'}. Best is trial 44 with value: 0.9430480003356934.
Trial 63 finished with value: 0.5696745812892914 and parameters: {'batch_size': 128, 'filters': 9, 'kernel_size': 3, 'kernel_regularizer': None, 'bias_regularizer': 'l1', 'activation': 'relu', 'activation_dense': 'swish', 'kernel_regularizer_dense1': 'l1', 'bias_regularizer_dense1': 'l1', 'kernel_regularizer_dense2': 'l1', 'bias_regularizer_dense2': None, 'optimizer': 'adam'}. Best is trial 44 with value: 0.9430480003356934.
Trial 64 finished with value: 0.7038615643978119 and parameters: {'batch_size': 128, 'filters': 12, 'kernel_size': 5, 'kernel_regularizer': None, 'bias_regularizer': 'l1', 'activation': 'relu', 'activation_dense': 'relu', 'kernel_regularizer_dense1': 'l1', 'bias_regularizer_dense1': None, 'kernel_regularizer_dense2': None, 'bias_regularizer_dense2': None, 'optimizer': 'adam'}. Best is trial 44 with value: 0.9430480003356934.
Trial 65 finished with value: 0.6958177089691162 and parameters: {'batch_size': 256, 'filters': 12, 'kernel_size': 5, 'kernel_regularizer': None, 'bias_regularizer': 'l1', 'activation': 'relu', 'activation_dense': 'swish', 'kernel_regularizer_dense1': 'l1', 'bias_regularizer_dense1': 'l1', 'kernel_regularizer_dense2': 'l1_l2', 'bias_regularizer_dense2': None, 'optimizer': 'adam'}. Best is trial 44 with value: 0.9430480003356934.
Trial 66 finished with value: 0.5864865481853485 and parameters: {'batch_size': 128, 'filters': 10, 'kernel_size': 5, 'kernel_regularizer': None, 'bias_regularizer': 'l1', 'activation': 'swish', 'activation_dense': 'swish', 'kernel_regularizer_dense1': 'l1', 'bias_regularizer_dense1': None, 'kernel_regularizer_dense2': 'l1', 'bias_regularizer_dense2': 'l1_l2', 'optimizer': 'adam'}. Best is trial 44 with value: 0.9430480003356934.
Trial 67 finished with value: 0.6363659203052521 and parameters: {'batch_size': 256, 'filters': 11, 'kernel_size': 5, 'kernel_regularizer': 'l1_l2', 'bias_regularizer': 'l1', 'activation': 'relu', 'activation_dense': 'swish', 'kernel_regularizer_dense1': 'l1', 'bias_regularizer_dense1': 'l1_l2', 'kernel_regularizer_dense2': 'l1', 'bias_regularizer_dense2': None, 'optimizer': 'adam'}. Best is trial 44 with value: 0.9430480003356934.
Trial 68 finished with value: 0.38704559206962585 and parameters: {'batch_size': 128, 'filters': 11, 'kernel_size': 5, 'kernel_regularizer': 'l1_l2', 'bias_regularizer': 'l1', 'activation': 'swish', 'activation_dense': 'swish', 'kernel_regularizer_dense1': 'l1', 'bias_regularizer_dense1': 'l1_l2', 'kernel_regularizer_dense2': 'l1', 'bias_regularizer_dense2': 'l1_l2', 'optimizer': 'adam'}. Best is trial 44 with value: 0.9430480003356934.
Trial 69 finished with value: 0.6565801203250885 and parameters: {'batch_size': 128, 'filters': 11, 'kernel_size': 5, 'kernel_regularizer': None, 'bias_regularizer': None, 'activation': 'swish', 'activation_dense': 'relu', 'kernel_regularizer_dense1': 'l1', 'bias_regularizer_dense1': 'l1_l2', 'kernel_regularizer_dense2': 'l1', 'bias_regularizer_dense2': None, 'optimizer': 'adam'}. Best is trial 44 with value: 0.9430480003356934.
Trial 70 finished with value: 0.8292146325111389 and parameters: {'batch_size': 256, 'filters': 12, 'kernel_size': 3, 'kernel_regularizer': None, 'bias_regularizer': 'l1', 'activation': 'relu', 'activation_dense': 'relu', 'kernel_regularizer_dense1': 'l1', 'bias_regularizer_dense1': 'l1', 'kernel_regularizer_dense2': None, 'bias_regularizer_dense2': None, 'optimizer': 'nadam'}. Best is trial 44 with value: 0.9430480003356934.
Trial 71 finished with value: 0.5582921355962753 and parameters: {'batch_size': 128, 'filters': 7, 'kernel_size': 4, 'kernel_regularizer': None, 'bias_regularizer': 'l1', 'activation': 'swish', 'activation_dense': 'swish', 'kernel_regularizer_dense1': None, 'bias_regularizer_dense1': 'l1_l2', 'kernel_regularizer_dense2': 'l1', 'bias_regularizer_dense2': 'l1_l2', 'optimizer': 'adam'}. Best is trial 44 with value: 0.9430480003356934.
Trial 72 finished with value: 0.9341877400875092 and parameters: {'batch_size': 128, 'filters': 14, 'kernel_size': 5, 'kernel_regularizer': None, 'bias_regularizer': 'l1', 'activation': 'relu', 'activation_dense': 'swish', 'kernel_regularizer_dense1': 'l1', 'bias_regularizer_dense1': None, 'kernel_regularizer_dense2': 'l1', 'bias_regularizer_dense2': None, 'optimizer': 'adam'}. Best is trial 44 with value: 0.9430480003356934.
Trial 73 finished with value: 0.8145089149475098 and parameters: {'batch_size': 128, 'filters': 11, 'kernel_size': 5, 'kernel_regularizer': None, 'bias_regularizer': 'l1', 'activation': 'relu', 'activation_dense': 'swish', 'kernel_regularizer_dense1': 'l1', 'bias_regularizer_dense1': None, 'kernel_regularizer_dense2': 'l1', 'bias_regularizer_dense2': None, 'optimizer': 'adam'}. Best is trial 44 with value: 0.9430480003356934.
Trial 74 finished with value: 0.925276905298233 and parameters: {'batch_size': 256, 'filters': 13, 'kernel_size': 5, 'kernel_regularizer': None, 'bias_regularizer': 'l1', 'activation': 'relu', 'activation_dense': 'relu', 'kernel_regularizer_dense1': 'l1', 'bias_regularizer_dense1': 'l1', 'kernel_regularizer_dense2': 'l1', 'bias_regularizer_dense2': None, 'optimizer': 'adam'}. Best is trial 44 with value: 0.9430480003356934.
Trial 75 finished with value: 0.6335674226284027 and parameters: {'batch_size': 128, 'filters': 12, 'kernel_size': 5, 'kernel_regularizer': None, 'bias_regularizer': 'l1', 'activation': 'swish', 'activation_dense': 'swish', 'kernel_regularizer_dense1': 'l1_l2', 'bias_regularizer_dense1': 'l1_l2', 'kernel_regularizer_dense2': 'l1', 'bias_regularizer_dense2': 'l1', 'optimizer': 'adam'}. Best is trial 44 with value: 0.9430480003356934.
Trial 76 finished with value: 0.6458601653575897 and parameters: {'batch_size': 256, 'filters': 15, 'kernel_size': 5, 'kernel_regularizer': None, 'bias_regularizer': 'l1', 'activation': 'relu', 'activation_dense': 'relu', 'kernel_regularizer_dense1': 'l1_l2', 'bias_regularizer_dense1': None, 'kernel_regularizer_dense2': 'l1_l2', 'bias_regularizer_dense2': 'l1', 'optimizer': 'adam'}. Best is trial 44 with value: 0.9430480003356934.
Trial 77 finished with value: 0.5328661352396011 and parameters: {'batch_size': 128, 'filters': 11, 'kernel_size': 5, 'kernel_regularizer': None, 'bias_regularizer': 'l1_l2', 'activation': 'swish', 'activation_dense': 'swish', 'kernel_regularizer_dense1': 'l1', 'bias_regularizer_dense1': 'l1', 'kernel_regularizer_dense2': 'l1', 'bias_regularizer_dense2': None, 'optimizer': 'adam'}. Best is trial 44 with value: 0.9430480003356934.
Trial 78 finished with value: 0.6504516005516052 and parameters: {'batch_size': 128, 'filters': 9, 'kernel_size': 5, 'kernel_regularizer': None, 'bias_regularizer': 'l1_l2', 'activation': 'swish', 'activation_dense': 'swish', 'kernel_regularizer_dense1': 'l1', 'bias_regularizer_dense1': 'l1_l2', 'kernel_regularizer_dense2': 'l1', 'bias_regularizer_dense2': 'l1_l2', 'optimizer': 'adam'}. Best is trial 44 with value: 0.9430480003356934.
Trial 79 finished with value: 0.9432443976402283 and parameters: {'batch_size': 256, 'filters': 11, 'kernel_size': 4, 'kernel_regularizer': None, 'bias_regularizer': None, 'activation': 'relu', 'activation_dense': 'relu', 'kernel_regularizer_dense1': 'l1', 'bias_regularizer_dense1': 'l1', 'kernel_regularizer_dense2': None, 'bias_regularizer_dense2': None, 'optimizer': 'adam'}. Best is trial 79 with value: 0.9432443976402283.
Trial 80 finished with value: 0.4070570468902588 and parameters: {'batch_size': 256, 'filters': 11, 'kernel_size': 4, 'kernel_regularizer': None, 'bias_regularizer': 'l1_l2', 'activation': 'relu', 'activation_dense': 'sigmoid', 'kernel_regularizer_dense1': 'l1', 'bias_regularizer_dense1': 'l1', 'kernel_regularizer_dense2': None, 'bias_regularizer_dense2': None, 'optimizer': 'adam'}. Best is trial 79 with value: 0.9432443976402283.
Trial 81 finished with value: 0.4971714913845062 and parameters: {'batch_size': 256, 'filters': 10, 'kernel_size': 4, 'kernel_regularizer': None, 'bias_regularizer': None, 'activation': 'relu', 'activation_dense': 'relu', 'kernel_regularizer_dense1': 'l1', 'bias_regularizer_dense1': None, 'kernel_regularizer_dense2': None, 'bias_regularizer_dense2': None, 'optimizer': 'adam'}. Best is trial 79 with value: 0.9432443976402283.
Trial 82 finished with value: 0.4090142846107483 and parameters: {'batch_size': 128, 'filters': 8, 'kernel_size': 5, 'kernel_regularizer': None, 'bias_regularizer': 'l1', 'activation': 'swish', 'activation_dense': 'sigmoid', 'kernel_regularizer_dense1': 'l1', 'bias_regularizer_dense1': 'l1_l2', 'kernel_regularizer_dense2': 'l1', 'bias_regularizer_dense2': 'l1_l2', 'optimizer': 'nadam'}. Best is trial 79 with value: 0.9432443976402283.
Trial 83 finished with value: 0.9195781350135803 and parameters: {'batch_size': 256, 'filters': 10, 'kernel_size': 4, 'kernel_regularizer': None, 'bias_regularizer': None, 'activation': 'relu', 'activation_dense': 'relu', 'kernel_regularizer_dense1': 'l1', 'bias_regularizer_dense1': 'l1', 'kernel_regularizer_dense2': None, 'bias_regularizer_dense2': 'l1_l2', 'optimizer': 'adam'}. Best is trial 79 with value: 0.9432443976402283.
Trial 84 finished with value: 0.412629671394825 and parameters: {'batch_size': 256, 'filters': 13, 'kernel_size': 4, 'kernel_regularizer': 'l1', 'bias_regularizer': None, 'activation': 'swish', 'activation_dense': 'relu', 'kernel_regularizer_dense1': 'l1', 'bias_regularizer_dense1': 'l1', 'kernel_regularizer_dense2': None, 'bias_regularizer_dense2': None, 'optimizer': 'adam'}. Best is trial 79 with value: 0.9432443976402283.
Trial 85 finished with value: 0.9424741268157959 and parameters: {'batch_size': 128, 'filters': 15, 'kernel_size': 5, 'kernel_regularizer': None, 'bias_regularizer': 'l1', 'activation': 'relu', 'activation_dense': 'relu', 'kernel_regularizer_dense1': 'l1_l2', 'bias_regularizer_dense1': 'l1', 'kernel_regularizer_dense2': 'l1', 'bias_regularizer_dense2': 'l1', 'optimizer': 'adam'}. Best is trial 79 with value: 0.9432443976402283.
Trial 86 finished with value: 0.8951854705810547 and parameters: {'batch_size': 128, 'filters': 12, 'kernel_size': 5, 'kernel_regularizer': None, 'bias_regularizer': 'l1', 'activation': 'relu', 'activation_dense': 'relu', 'kernel_regularizer_dense1': 'l1_l2', 'bias_regularizer_dense1': 'l1', 'kernel_regularizer_dense2': 'l1', 'bias_regularizer_dense2': 'l1', 'optimizer': 'adam'}. Best is trial 79 with value: 0.9432443976402283.
Trial 87 finished with value: 0.5264255553483963 and parameters: {'batch_size': 128, 'filters': 14, 'kernel_size': 5, 'kernel_regularizer': None, 'bias_regularizer': 'l1', 'activation': 'relu', 'activation_dense': 'swish', 'kernel_regularizer_dense1': 'l1_l2', 'bias_regularizer_dense1': None, 'kernel_regularizer_dense2': 'l1_l2', 'bias_regularizer_dense2': 'l1', 'optimizer': 'nadam'}. Best is trial 79 with value: 0.9432443976402283.
Trial 88 finished with value: 0.4309597387909889 and parameters: {'batch_size': 128, 'filters': 14, 'kernel_size': 5, 'kernel_regularizer': None, 'bias_regularizer': 'l1', 'activation': 'relu', 'activation_dense': 'swish', 'kernel_regularizer_dense1': 'l1_l2', 'bias_regularizer_dense1': 'l1', 'kernel_regularizer_dense2': 'l1', 'bias_regularizer_dense2': 'l1_l2', 'optimizer': 'adam'}. Best is trial 79 with value: 0.9432443976402283.
Trial 89 finished with value: 0.8354063928127289 and parameters: {'batch_size': 128, 'filters': 9, 'kernel_size': 5, 'kernel_regularizer': None, 'bias_regularizer': None, 'activation': 'relu', 'activation_dense': 'relu', 'kernel_regularizer_dense1': 'l1', 'bias_regularizer_dense1': 'l1', 'kernel_regularizer_dense2': None, 'bias_regularizer_dense2': None, 'optimizer': 'nadam'}. Best is trial 79 with value: 0.9432443976402283.
Trial 90 finished with value: 0.9384199976921082 and parameters: {'batch_size': 128, 'filters': 15, 'kernel_size': 5, 'kernel_regularizer': None, 'bias_regularizer': 'l1', 'activation': 'relu', 'activation_dense': 'swish', 'kernel_regularizer_dense1': 'l1_l2', 'bias_regularizer_dense1': None, 'kernel_regularizer_dense2': 'l1', 'bias_regularizer_dense2': 'l1', 'optimizer': 'adam'}. Best is trial 79 with value: 0.9432443976402283.
Trial 91 finished with value: 0.48316170275211334 and parameters: {'batch_size': 128, 'filters': 15, 'kernel_size': 3, 'kernel_regularizer': 'l1_l2', 'bias_regularizer': 'l1', 'activation': 'relu', 'activation_dense': 'swish', 'kernel_regularizer_dense1': 'l1', 'bias_regularizer_dense1': None, 'kernel_regularizer_dense2': 'l1', 'bias_regularizer_dense2': None, 'optimizer': 'adam'}. Best is trial 79 with value: 0.9432443976402283.
Trial 92 finished with value: 0.6443352103233337 and parameters: {'batch_size': 128, 'filters': 15, 'kernel_size': 5, 'kernel_regularizer': None, 'bias_regularizer': 'l1', 'activation': 'relu', 'activation_dense': 'swish', 'kernel_regularizer_dense1': 'l1_l2', 'bias_regularizer_dense1': None, 'kernel_regularizer_dense2': 'l1', 'bias_regularizer_dense2': 'l1', 'optimizer': 'adam'}. Best is trial 79 with value: 0.9432443976402283.
Trial 93 finished with value: 0.7272906005382538 and parameters: {'batch_size': 256, 'filters': 13, 'kernel_size': 4, 'kernel_regularizer': 'l1_l2', 'bias_regularizer': None, 'activation': 'relu', 'activation_dense': 'relu', 'kernel_regularizer_dense1': None, 'bias_regularizer_dense1': 'l1', 'kernel_regularizer_dense2': None, 'bias_regularizer_dense2': None, 'optimizer': 'adam'}. Best is trial 79 with value: 0.9432443976402283.
Trial 94 finished with value: 0.930255264043808 and parameters: {'batch_size': 256, 'filters': 11, 'kernel_size': 4, 'kernel_regularizer': None, 'bias_regularizer': None, 'activation': 'relu', 'activation_dense': 'relu', 'kernel_regularizer_dense1': 'l1_l2', 'bias_regularizer_dense1': 'l1', 'kernel_regularizer_dense2': None, 'bias_regularizer_dense2': None, 'optimizer': 'adam'}. Best is trial 79 with value: 0.9432443976402283.
Trial 95 finished with value: 0.9389567375183105 and parameters: {'batch_size': 256, 'filters': 13, 'kernel_size': 4, 'kernel_regularizer': None, 'bias_regularizer': None, 'activation': 'relu', 'activation_dense': 'relu', 'kernel_regularizer_dense1': 'l1', 'bias_regularizer_dense1': 'l1', 'kernel_regularizer_dense2': None, 'bias_regularizer_dense2': None, 'optimizer': 'nadam'}. Best is trial 79 with value: 0.9432443976402283.
Trial 96 finished with value: 0.6301142573356628 and parameters: {'batch_size': 128, 'filters': 14, 'kernel_size': 5, 'kernel_regularizer': 'l1_l2', 'bias_regularizer': 'l1_l2', 'activation': 'relu', 'activation_dense': 'swish', 'kernel_regularizer_dense1': 'l1_l2', 'bias_regularizer_dense1': None, 'kernel_regularizer_dense2': 'l1', 'bias_regularizer_dense2': 'l1', 'optimizer': 'nadam'}. Best is trial 79 with value: 0.9432443976402283.
Trial 97 finished with value: 0.4207566976547241 and parameters: {'batch_size': 256, 'filters': 11, 'kernel_size': 4, 'kernel_regularizer': None, 'bias_regularizer': None, 'activation': 'sigmoid', 'activation_dense': 'relu', 'kernel_regularizer_dense1': 'l1', 'bias_regularizer_dense1': 'l1', 'kernel_regularizer_dense2': None, 'bias_regularizer_dense2': None, 'optimizer': 'nadam'}. Best is trial 79 with value: 0.9432443976402283.
Trial 98 finished with value: 0.47566837072372437 and parameters: {'batch_size': 256, 'filters': 13, 'kernel_size': 4, 'kernel_regularizer': 'l1_l2', 'bias_regularizer': None, 'activation': 'relu', 'activation_dense': 'relu', 'kernel_regularizer_dense1': 'l1', 'bias_regularizer_dense1': 'l1', 'kernel_regularizer_dense2': None, 'bias_regularizer_dense2': None, 'optimizer': 'nadam'}. Best is trial 79 with value: 0.9432443976402283.
